<?xml version="1.0" encoding="UTF-8"?>
<?xml-stylesheet type="text/css" href="employee.css"?>
<!DOCTYPE Employees SYSTEM "employee.dtd">


<Employees>
     <Employee>
             <Name>weam</Name>
             <Addresses>
             <Address>
                   <Street>st-school</Street>
                   <Building_No>3nd</Building_No>
                   <Region>kafrelshiesh</Region>
                  <City>kafrelshiesh</City>
                   <Country>Egypt</Country>
              </Address>
               <Address>
                   <Street>st-school</Street>
                   <Building_No>3nd</Building_No>
                   <Region>kafrelshiesh</Region>
                  <City>kafrelshiesh</City>
                   <Country>Egypt</Country>
              </Address>
               </Addresses>
              <Phones>
                  <Phone type='home'>98877656</Phone>
                  <Phone type='mobile'>09987665434356</Phone>
              </Phones>
              <Email>weam@gmail.com</Email>
  </Employee>
  <Employee>
        <Name>nour</Name>
          <Addresses>
             <Address>
                   <Street>st-school</Street>
                   <Building_No>6nd</Building_No>
                   <Region>kafrelshiesh</Region>
                  <City>kafrelshiesh</City>
                   <Country>Egypt</Country>
              </Address>
               <Address>
                   <Street>st-school</Street>
                   <Building_No>6nd</Building_No>
                   <Region>kafrelshiesh</Region>
                  <City>kafrelshiesh</City>
                   <Country>Egypt</Country>
              </Address>
               </Addresses>
               <Phones>
                 <Phone type="home">9876756</Phone>
                  <Phone type="mobile">978765655434356</Phone>
              </Phones>
             <Email>nour@gmail.com</Email>
</Employee>
    <Employee>
          <Name> asmaa</Name>
          <Addresses>
             <Address>
                   <Street>st-school</Street>
                   <Building_No>9nd</Building_No>
                   <Region>kafrelshiesh</Region>
                  <City>kafrelshiesh</City>
                   <Country>Egypt</Country>
              </Address>
               <Address>
                   <Street>st-school</Street>
                   <Building_No>9nd</Building_No>
                   <Region>kafrelshiesh</Region>
                  <City>kafrelshiesh</City>
                   <Country>Egypt</Country>
              </Address>
               </Addresses>
                <Phones>
                   <Phone type="home">98877656</Phone>
                   <Phone type="mobile">897865434356</Phone>
                </Phones>
                <Email>asmaa@gmail.com</Email>
   </Employee>
 
</Employees>
